{"schema_version":1,"id":"focus_01JYX","project":{"peer_id":"peer_hero","registry_slug":"hero","display_name":"Hero"},"title":"Finish inbox contracts","prompt":"Deliver durable-attention-contracts and verify every acceptance criterion.","lifecycle":"today","revision":3,"created_at":"2026-07-22T17:00:00Z","updated_at":"2026-07-22T18:00:00.5Z"}
